{
  "$schema":"https://json-schema.org/draft/2020-12/schema","type":"object","additionalProperties":false,
  "required":["schema_version","experiment_id","experiment_version","created_at_utc","hypothesis","rationale","research_scope","dataset","metrics","evaluation_design","leakage_controls","cost_execution_reference","parameter_space","trial_budget","stopping_rule","seeds","code_config_reference","status"],
  "properties":{"schema_version":{"const":2},"experiment_id":{"type":"string","pattern":"^[A-Z0-9_-]+$"},"experiment_version":{"type":"integer","minimum":1},"created_at_utc":{"type":"string","format":"date-time"},"hypothesis":{"type":"string","minLength":1},"rationale":{"type":"string","minLength":1},"research_scope":{"type":"string","minLength":1},"dataset":{"type":"object","additionalProperties":false,"required":["manifest_id","content_hash","maximum_timestamp"],"properties":{"manifest_id":{"type":"string"},"content_hash":{"$ref":"#/$defs/hash"},"maximum_timestamp":{"type":"string","format":"date-time"}}},"metrics":{"type":"object","additionalProperties":false,"required":["primary","secondary"],"properties":{"primary":{"type":"string","minLength":1},"secondary":{"type":"array","items":{"type":"string"},"uniqueItems":true}}},"evaluation_design":{"type":"string","minLength":1},"leakage_controls":{"type":"array","items":{"type":"string"},"minItems":1},"cost_execution_reference":{"type":"string","minLength":1},"parameter_space":{"type":"object"},"trial_budget":{"type":"integer","minimum":1},"stopping_rule":{"type":"string","minLength":1},"seeds":{"type":"array","items":{"type":"integer"},"minItems":1,"uniqueItems":true},"code_config_reference":{"type":"string","minLength":1},"status":{"enum":["PREREGISTERED","RUNNING"]}},
  "$defs":{"hash":{"type":"string","pattern":"^[a-f0-9]{64}$"}}
}
