{
  "code_config_reference": "b638503d00df71eed11864ab4f52a632b6c690d32f619406a81f4d0edb235b52",
  "cost_execution_reference": "BACKTEST_ENGINE_V2 / EXECUTION_MODEL_V2 / BTCUSDT_SPOT_COST_V1",
  "created_at_utc": "2026-09-12T20:00:00Z",
  "dataset": {
    "content_hash": "02168b73d8513d825978cdde3cc133e466b4aebcc0aaa48fecfb473de6e3acb2",
    "manifest_id": "BTCUSDT-SPOT-1M-DEV-v1",
    "maximum_timestamp": "2024-12-31T23:59:00Z"
  },
  "evaluation_design": "Six annual expanding folds 2019-2024; one OLS per fold; 216h purge; complete label outcomes before boundary; four frozen profiles; matched NFCI-available universe.",
  "experiment_id": "EXP-ML-020-NFCI-CONTEXT-INTERACTIONS",
  "experiment_version": 1,
  "hypothesis": "Point-in-time financial conditions may continuously modify the predictive relationship between internal BTC market/order-flow signals and net LONG opportunity; fixed NFCI-signal interaction terms may improve robust after-cost expectancy over a matched internal-only linear model.",
  "leakage_controls": [
    "FEATURES_AVAILABLE_BY_SIGNAL_TIME",
    "NFCI_CONSERVATIVE_NEXT_CALENDAR_DAY_AVAILABILITY",
    "NFCI_POINT_IN_TIME_VINTAGE_NO_FUTURE_REVISION",
    "RAW_INTERACTIONS_BEFORE_TRAINING_ONLY_SCALING",
    "TRAINING_SIGNAL_AND_OUTCOME_STRICTLY_BEFORE_VALIDATION_MINUS_216H",
    "NO_VALIDATION_REFIT_SELECTION_OR_POST_CUTOFF_ACCESS"
  ],
  "metrics": {
    "primary": "POOLED_VALID_RESOLVED_DEFAULT_NET_R",
    "secondary": [
      "profiles",
      "terminal_classification",
      "annual_folds",
      "condition_numbers",
      "coefficient_sign_stability",
      "effective_slopes_at_nfci_minus1_zero_plus1",
      "prediction_diagnostics",
      "independent_reconciliation"
    ]
  },
  "parameter_space": {
    "allocation_id": "WP013-CONTEXTUAL-NFCI-ALLOCATION",
    "architecture": "CONTEXTUAL_NFCI_INTERACTION_OLS_V1",
    "behavior_hash": "d2508eb5ee6783134e3a886f6ddf5241a1453c49ea71cfcf40e1d2610ffc4cb6",
    "context_transforms_searched": 0,
    "declared_trial_budget": {
      "configurations": 1,
      "model_fits": 6,
      "profiles": 4,
      "seeds": 0,
      "total_trials": 4
    },
    "dependencies": [
      {
        "path": "backend/app/data/policy.py",
        "sha256": "b4e7a48fefb3b8d4454ffb4a4f48c09944cab0e2dd667b65311398e756a1b1a3"
      },
      {
        "path": "backend/app/backtest/models.py",
        "sha256": "81ef772e759a5983dbf671af4b372a08e910ec19ec539a5a2e4e3df5dc1d9845"
      },
      {
        "path": "backend/app/backtest/engine.py",
        "sha256": "d393034e521af5741ababa7b9a5efff715131e311539ffdf10ab01ab15ec74a1"
      },
      {
        "path": "backend/app/research/evaluation_protocol.py",
        "sha256": "1b5d71a57caef1cd2dfafcc1eb4b1ccb13415bcb51d1ef4e9ad253996998c512"
      },
      {
        "path": "backend/app/research/continuation_lab.py",
        "sha256": "66ae60aa5b91315c8d2d224bcc40caeaa6b843ca2790a10d242b0cffb7c733d9"
      },
      {
        "path": "backend/app/research/order_flow.py",
        "sha256": "9396b1335247e03fdfe2942dfae7a9ea8d75bd6da7ecb1e1ff8ab43059fb5a8a"
      },
      {
        "path": "backend/app/research/supervised.py",
        "sha256": "c887e1d67880322b6fd02c7d38c930c9aa862a4c532962b9667f1da275c47318"
      },
      {
        "path": "backend/app/research/linear_model.py",
        "sha256": "9f6099452211072c8a459ca3ee257d4416caf3c56643a9c4ec7a698dbad19545"
      },
      {
        "path": "backend/app/research/macro.py",
        "sha256": "77fdbc20a22b77eafe837d50302c6395e71d84feb0b00a94fa0ebb330344fc56"
      },
      {
        "path": "backend/app/research/nfci_context.py",
        "sha256": "8361a765ec7b5e5fba351a2ea085cc47e2f74bb2b882301a3505b97a4703f9c5"
      },
      {
        "path": "backend/app/research/wp013_lab.py",
        "sha256": "a9cc4c40c73aaaa3e8a2733488b2f2c3159d13ecc50e9019497e8d393ec2ebbc"
      },
      {
        "path": "backend/app/research/artifacts.py",
        "sha256": "0f4b8c7b4dcc9b8f26fc7a3d5b5c086e817cb2358184ab6b0b84af923c5987cb"
      },
      {
        "path": "backend/app/research/search_memory_v2.py",
        "sha256": "055f5ef83449e18eb52f77f8f24b0f46e7751874bb20fa0a0c91597d8706ab7f"
      },
      {
        "path": "research/protocols/WP-013-CONTEXTUAL-NFCI-INTERACTIONS-V1.json",
        "sha256": "c06f221eac504d32012abf3afa4c6820c74e04f409f6e06b77b8d0c9ad553726"
      }
    ],
    "executable_spec_hash": "989deee0aa353ff7ab4f65bf4316a5271e087da063514eecb105e2c1eea96fa6",
    "feature_count": 16,
    "features": [
      "LOG_RETURN_1H",
      "LOG_RETURN_24H",
      "LOG_DISTANCE_TO_PRIOR_24H_HIGH",
      "REALIZED_VOL_24H",
      "LOG_RELATIVE_VOLUME_1H",
      "DIRECTIONAL_EFFICIENCY_4H",
      "TAKER_BUY_SHARE_1H_CENTERED",
      "TAKER_BUY_SHARE_4H_CENTERED",
      "LOG_RETURN_1H_X_NFCI",
      "LOG_RETURN_24H_X_NFCI",
      "LOG_DISTANCE_TO_PRIOR_24H_HIGH_X_NFCI",
      "REALIZED_VOL_24H_X_NFCI",
      "LOG_RELATIVE_VOLUME_1H_X_NFCI",
      "DIRECTIONAL_EFFICIENCY_4H_X_NFCI",
      "TAKER_BUY_SHARE_1H_CENTERED_X_NFCI",
      "TAKER_BUY_SHARE_4H_CENTERED_X_NFCI"
    ],
    "hypothesis_id": "NFCI_MODULATES_INTERNAL_SIGNAL_VALUE_V1",
    "interaction_count": 8,
    "interaction_subsets_searched": 0,
    "nfci_direct_feature": false,
    "numeric_parameter_variants": 0,
    "root_family": "FAM-CONTEXTUAL-MACRO-INTERACTIONS",
    "signal_threshold": 0.0,
    "structural_hash": "95fd9d65db62111a173181f782c43d40141ab4122bc5b9d4b542d5e3fc66fba4",
    "threshold_searches": 0,
    "update_cadence": "ONCE_PER_FOLD_NO_VALIDATION_REFIT",
    "variant": "NFCI_CONTEXT_INTERACTIONS"
  },
  "rationale": "A distinct continuous interaction mechanism; not a rescue of additive macro EWLS or binary regime experts. Predictive, not causal.",
  "research_scope": "DEVELOPMENT_WALK_FORWARD_NO_SEALED_ACCESS_NO_PAPER_EVIDENCE",
  "schema_version": 2,
  "seeds": [
    0
  ],
  "status": "PREREGISTERED",
  "stopping_rule": "Exactly four frozen profiles; no context transform, interaction subset, threshold, feature, model, or post-result variant.",
  "trial_budget": 4
}
