{
  "code_config_reference": "d568963d7a1113d0ba5ec26b7f07d16a142161674bf7a4a72da49f00290cd19a",
  "cost_execution_reference": "BACKTEST_ENGINE_V2 / EXECUTION_MODEL_V2 / BTCUSDT_SPOT_COST_V1",
  "created_at_utc": "2026-09-08T21:33:32.846706Z",
  "dataset": {
    "content_hash": "02168b73d8513d825978cdde3cc133e466b4aebcc0aaa48fecfb473de6e3acb2",
    "manifest_id": "BTCUSDT-SPOT-1M-DEV-v1",
    "maximum_timestamp": "2024-12-31T23:59:00Z"
  },
  "evaluation_design": "Fixed declared trial matrix under BASELINES_NEGATIVE_CONTROLS_V1; common eligible UTC hourly clock and 1m execution.",
  "experiment_id": "EXP-BASE-003-TREND",
  "experiment_version": 1,
  "hypothesis": "Fixed SMA24 greater than SMA168 baseline",
  "leakage_controls": [
    "169 consecutive complete 1h bars",
    "as-of signal interface",
    "no post-cutoff access",
    "no adaptive trials"
  ],
  "metrics": {
    "primary": "Default-cost net expectancy R",
    "secondary": [
      "default_metrics",
      "zero_cost_metrics",
      "double_cost_metrics"
    ]
  },
  "parameter_space": {
    "classification": "FIXED_BASELINE_NOT_CANDIDATE",
    "strategy_path": "backend/app/research/baselines.py",
    "strategy_sha256": "5d8f2f3faa003781aafd506ca004121f25213ad46d5cff9611e4e54ae16f1a3d",
    "trial_plan": [
      {
        "config_path": "research/configs/trend.json",
        "config_sha256": "eef4a1e330d41c6e6712891bebe3a00874fcd2a5d08a26438825b2e88abedd91",
        "trial_id": "trend-0"
      },
      {
        "config_path": "research/configs/trend.json",
        "config_sha256": "eef4a1e330d41c6e6712891bebe3a00874fcd2a5d08a26438825b2e88abedd91",
        "trial_id": "trend-1"
      },
      {
        "config_path": "research/configs/trend.json",
        "config_sha256": "eef4a1e330d41c6e6712891bebe3a00874fcd2a5d08a26438825b2e88abedd91",
        "trial_id": "trend-2"
      }
    ]
  },
  "rationale": "Preregistered fixed WP-003 laboratory comparison; negative results are retained.",
  "research_scope": "BTCUSDT Spot development data only; LONG/no-entry; no optimization or promotion.",
  "schema_version": 2,
  "seeds": [
    0,
    1,
    2
  ],
  "status": "PREREGISTERED",
  "stopping_rule": "Execute every declared trial exactly once; no early stopping or additions.",
  "trial_budget": 3
}
