{
  "code_config_reference": "1706fa56334b11a9e7a74d3fec172afd217c011e76c46b56744d931b35b6e4a9",
  "cost_execution_reference": "BACKTEST_ENGINE_V2 / EXECUTION_MODEL_V2 / BTCUSDT_SPOT_COST_V1",
  "created_at_utc": "2026-09-12T00:00:00Z",
  "dataset": {
    "content_hash": "02168b73d8513d825978cdde3cc133e466b4aebcc0aaa48fecfb473de6e3acb2",
    "manifest_id": "BTCUSDT-SPOT-1M-DEV-v1",
    "maximum_timestamp": "2024-12-31T23:59:00Z"
  },
  "evaluation_design": "Six frozen annual folds 2019-2024. Each expert is fitted once per fold on every eligible historical row whose signal instant and complete label outcome both precede validation start minus 216 hours, partitioned by the point-in-time regime of the signal hour. Coefficients are held fixed across the validation year. Four fixed execution profiles. An infeasible regime expert emits nothing and its hours are counted, never merged.",
  "experiment_id": "EXP-ML-018-REGIME-TWO-EXPERTS",
  "experiment_version": 1,
  "hypothesis": "The relationship between the eight frozen internal features and forward net R differs between financial regimes, so two independently fitted experts selected by a point-in-time NFCI gate can select BTCUSDT LONG opportunities with robust positive net expectancy after realistic costs.",
  "leakage_controls": [
    "FEATURES_AVAILABLE_BY_SIGNAL_TIME",
    "REGIME_CONSERVATIVE_NEXT_CALENDAR_DAY_AVAILABILITY",
    "REGIME_POINT_IN_TIME_VINTAGE_NO_FUTURE_REVISION",
    "COMPLETED_CONTIGUOUS_UNQUARANTINED_WINDOWS",
    "TRAINING_ONLY_DEFAULT_LABELS",
    "TRAINING_ONLY_PER_EXPERT_SCALING",
    "TRAINING_SIGNAL_AND_OUTCOME_STRICTLY_BEFORE_VALIDATION_MINUS_216H",
    "NO_VALIDATION_REFIT_OR_FEATURE_SELECTION",
    "MISSING_REGIME_INELIGIBLE_NEVER_IMPUTED",
    "POST_CUTOFF_HARD_FAIL"
  ],
  "metrics": {
    "primary": "POOLED_VALID_RESOLVED_DEFAULT_NET_R",
    "secondary": [
      "profiles",
      "terminal_classification",
      "regime_diagnostics",
      "expert_coefficient_comparison",
      "infeasible_expert_accounting",
      "uncovered_hour_accounting",
      "prediction_diagnostics",
      "artifact_manifest"
    ]
  },
  "parameter_space": {
    "algorithm_variants": 0,
    "allocation_id": "WP012-REGIME-CONDITIONED-ALLOCATION",
    "architecture": "REGIME_CONDITIONED_LINEAR_EXPERTS_V1",
    "behavior_hash": "b9fa58e836a4ed4ce4d671bd05d564c0da7adcfb1cef479719ee551936c51a62",
    "declared_trial_budget": {
      "configurations": 1,
      "model_fits": 12,
      "profiles": 4,
      "seeds": 0,
      "total_trials": 4
    },
    "dependencies": [
      {
        "path": "backend/app/data/policy.py",
        "sha256": "b4e7a48fefb3b8d4454ffb4a4f48c09944cab0e2dd667b65311398e756a1b1a3"
      },
      {
        "path": "backend/app/backtest/models.py",
        "sha256": "81ef772e759a5983dbf671af4b372a08e910ec19ec539a5a2e4e3df5dc1d9845"
      },
      {
        "path": "backend/app/backtest/engine.py",
        "sha256": "d393034e521af5741ababa7b9a5efff715131e311539ffdf10ab01ab15ec74a1"
      },
      {
        "path": "backend/app/research/evaluation_protocol.py",
        "sha256": "1b5d71a57caef1cd2dfafcc1eb4b1ccb13415bcb51d1ef4e9ad253996998c512"
      },
      {
        "path": "backend/app/research/continuation_lab.py",
        "sha256": "66ae60aa5b91315c8d2d224bcc40caeaa6b843ca2790a10d242b0cffb7c733d9"
      },
      {
        "path": "backend/app/research/order_flow.py",
        "sha256": "9396b1335247e03fdfe2942dfae7a9ea8d75bd6da7ecb1e1ff8ab43059fb5a8a"
      },
      {
        "path": "backend/app/research/supervised.py",
        "sha256": "c887e1d67880322b6fd02c7d38c930c9aa862a4c532962b9667f1da275c47318"
      },
      {
        "path": "backend/app/research/linear_model.py",
        "sha256": "9f6099452211072c8a459ca3ee257d4416caf3c56643a9c4ec7a698dbad19545"
      },
      {
        "path": "backend/app/research/macro.py",
        "sha256": "77fdbc20a22b77eafe837d50302c6395e71d84feb0b00a94fa0ebb330344fc56"
      },
      {
        "path": "backend/app/research/regime.py",
        "sha256": "ee46c47563f44773d8c83197c051015849f45ab7e93ad0255f6a59255b5a02cb"
      },
      {
        "path": "backend/app/research/wp012_lab.py",
        "sha256": "0f0b8abbcf327333d59890be5c20eaad07c2874bccf29975c809a5d122919e01"
      },
      {
        "path": "backend/app/research/artifacts.py",
        "sha256": "0f4b8c7b4dcc9b8f26fc7a3d5b5c086e817cb2358184ab6b0b84af923c5987cb"
      },
      {
        "path": "backend/app/research/search_memory_v2.py",
        "sha256": "055f5ef83449e18eb52f77f8f24b0f46e7751874bb20fa0a0c91597d8706ab7f"
      },
      {
        "path": "research/protocols/WP-012-REGIME-CONDITIONED-V1.json",
        "sha256": "57e936d8fc8a80459ef6a3892f4ce90c832778a05602f46a83f57a1a6ade8f80"
      }
    ],
    "executable_spec_hash": "e656a4347d613e6a2666fce9a5c16afc958cb34a685c90d695ed9828d0f3f0e6",
    "experts_per_fold": 2,
    "feature_count": 8,
    "feature_subset_searches": 0,
    "features": [
      "LOG_RETURN_1H",
      "LOG_RETURN_24H",
      "LOG_DISTANCE_TO_PRIOR_24H_HIGH",
      "REALIZED_VOL_24H",
      "LOG_RELATIVE_VOLUME_1H",
      "DIRECTIONAL_EFFICIENCY_4H",
      "TAKER_BUY_SHARE_1H_CENTERED",
      "TAKER_BUY_SHARE_4H_CENTERED"
    ],
    "hyperparameter_searches": 0,
    "hypothesis_id": "FINANCIAL_REGIME_CONDITIONED_SIGNAL_WEIGHTS_V1",
    "macro_features_in_expert_matrix": 0,
    "macro_variable_variants": 0,
    "numeric_parameter_variants": 0,
    "regime_count_variants": 0,
    "regime_manifest_id": "ALFRED-MACRO-CONTEXT-DEV-v1",
    "regime_series": "NFCI",
    "regime_source_version": "ALFRED_MACRO_CONTEXT_V1",
    "regime_threshold": 0.0,
    "regime_threshold_variants": 0,
    "regime_version": "FINANCIAL_CONDITIONS_REGIME_V1",
    "root_family": "FAM-REGIME-CONDITIONED-LINEAR",
    "signal_threshold": 0.0,
    "structural_hash": "f35b324ecdf79314765b48dc86e0e41543ddf9bd669364e0da2c708a8fa6319e",
    "threshold_searches": 0,
    "update_cadence": "ONCE_PER_FOLD_NO_VALIDATION_REFIT",
    "variant": "REGIME_TWO_EXPERTS"
  },
  "rationale": "WP-008 falsified one fixed global linear weight vector over these eight features and WP-011 falsified adding point-in-time macro levels as additive predictors. Neither tested conditioning: whether the mapping itself differs between financial regimes. This is predictive, not causal.",
  "research_scope": "DEVELOPMENT_WALK_FORWARD_NO_SEALED_ACCESS_NO_PAPER_EVIDENCE",
  "schema_version": 2,
  "seeds": [
    0
  ],
  "status": "PREREGISTERED",
  "stopping_rule": "Exactly four frozen profiles for this configuration. No additional experiment, threshold, macro variable, regime count, smoothing, hysteresis, lag variant, feature subset or refit after observing any result.",
  "trial_budget": 4
}
