{
  "code_config_reference": "7f9011ba48b7280742d3c06e9d7c3c0b14f60b57dc35a8ef995a8bdfb49fb5d1",
  "cost_execution_reference": "BACKTEST_ENGINE_V2 / EXECUTION_MODEL_V2 / BTCUSDT_SPOT_COST_V1",
  "created_at_utc": "2026-09-08T21:33:32.846706Z",
  "dataset": {
    "content_hash": "02168b73d8513d825978cdde3cc133e466b4aebcc0aaa48fecfb473de6e3acb2",
    "manifest_id": "BTCUSDT-SPOT-1M-DEV-v1",
    "maximum_timestamp": "2024-12-31T23:59:00Z"
  },
  "evaluation_design": "Fixed declared trial matrix under BASELINES_NEGATIVE_CONTROLS_V1; common eligible UTC hourly clock and 1m execution.",
  "experiment_id": "EXP-BASE-001-BUYHOLD",
  "experiment_version": 1,
  "hypothesis": "BTC market direction endpoint reference",
  "leakage_controls": [
    "169 consecutive complete 1h bars",
    "as-of signal interface",
    "no post-cutoff access",
    "no adaptive trials"
  ],
  "metrics": {
    "primary": "Net total return",
    "secondary": [
      "gross_total_return",
      "cost_drag",
      "coverage_minutes",
      "first_timestamp_us",
      "last_timestamp_us"
    ]
  },
  "parameter_space": {
    "classification": "REFERENCE_ONLY_NOT_PRODUCT_CANDIDATE",
    "strategy_path": "backend/app/research/baselines.py",
    "strategy_sha256": "5d8f2f3faa003781aafd506ca004121f25213ad46d5cff9611e4e54ae16f1a3d",
    "trial_plan": [
      {
        "config_path": "research/configs/buyhold.json",
        "config_sha256": "e7ae5a8c4729b854842eda7dee73b6b6d1091ee12aa7e721a7c3f30a62cdcd6d",
        "trial_id": "buyhold-0"
      }
    ]
  },
  "rationale": "Preregistered fixed WP-003 laboratory comparison; negative results are retained.",
  "research_scope": "BTCUSDT Spot development data only; LONG/no-entry; no optimization or promotion.",
  "schema_version": 2,
  "seeds": [
    0
  ],
  "status": "PREREGISTERED",
  "stopping_rule": "Execute every declared trial exactly once; no early stopping or additions.",
  "trial_budget": 1
}
