{
  "code_config_reference": "e18b74175d14953422602aa659924035a607e68553391a652a9e1533c6df6791",
  "cost_execution_reference": "BACKTEST_ENGINE_V2 / EXECUTION_MODEL_V2 / BTCUSDT_SPOT_COST_V1",
  "created_at_utc": "2026-09-08T21:33:32.846706Z",
  "dataset": {
    "content_hash": "02168b73d8513d825978cdde3cc133e466b4aebcc0aaa48fecfb473de6e3acb2",
    "manifest_id": "BTCUSDT-SPOT-1M-DEV-v1",
    "maximum_timestamp": "2024-12-31T23:59:00Z"
  },
  "evaluation_design": "Fixed declared trial matrix under BASELINES_NEGATIVE_CONTROLS_V1; common eligible UTC hourly clock and 1m execution.",
  "experiment_id": "EXP-CTRL-006-NO-TRADE",
  "experiment_version": 1,
  "hypothesis": "No-trade structural negative control",
  "leakage_controls": [
    "169 consecutive complete 1h bars",
    "as-of signal interface",
    "no post-cutoff access",
    "no adaptive trials"
  ],
  "metrics": {
    "primary": "No applicable trade metric",
    "secondary": [
      "attempted_setups",
      "trade_count",
      "invalid_attempts",
      "unresolved_trades",
      "unresolved_rate",
      "net_expectancy_r",
      "cumulative_net_r",
      "profit_factor",
      "maximum_drawdown_r",
      "hit_rate",
      "average_win_r",
      "average_loss_r",
      "cost_drag_r",
      "yearly"
    ]
  },
  "parameter_space": {
    "classification": "NEGATIVE_CONTROL",
    "strategy_path": "backend/app/research/baselines.py",
    "strategy_sha256": "5d8f2f3faa003781aafd506ca004121f25213ad46d5cff9611e4e54ae16f1a3d",
    "trial_plan": [
      {
        "config_path": "research/configs/no_trade.json",
        "config_sha256": "228b6d8a599b9cb2f9729223c87931e7b3a048b1a5c9656076e8aa4198a2d6f0",
        "trial_id": "no-trade-0"
      }
    ]
  },
  "rationale": "Preregistered fixed WP-003 laboratory comparison; negative results are retained.",
  "research_scope": "BTCUSDT Spot development data only; LONG/no-entry; no optimization or promotion.",
  "schema_version": 2,
  "seeds": [
    0
  ],
  "status": "PREREGISTERED",
  "stopping_rule": "Execute every declared trial exactly once; no early stopping or additions.",
  "trial_budget": 1
}
